{
  "$schema": "https://json-schema.org/draft/2020-12/schema",
  "$id": "https://echo.local/schemas/eval-case.schema.json",
  "title": "EvalCase",
  "description": "A single evaluation case for the Echo Agent Platform regression suite. Canonical schema stored at shared-agent/evals/schemas/eval-case.schema.json. This file is the docs mirror per invariant #8.",
  "type": "object",
  "required": ["id", "mechanism", "tags", "setup", "input", "assertions", "requiresLlm"],
  "properties": {
    "id": {
      "type": "string",
      "pattern": "^EVAL-\\d{3}$",
      "description": "Stable identifier. Never renumber. EVAL-001 through EVAL-999."
    },
    "mechanism": {
      "type": "string",
      "enum": ["composer", "topic", "memory", "affection", "cross-cutting"],
      "description": "Which agent-platform subsystem this case targets."
    },
    "tags": {
      "type": "array",
      "minItems": 1,
      "items": {
        "type": "string",
        "enum": [
          "style",
          "memory-leak",
          "hearsay",
          "topic-return",
          "smoke",
          "regression",
          "affection-label",
          "affection-delta",
          "affection-overlay"
        ]
      },
      "description": "At least one of the four CI dimensions (style, memory-leak, hearsay, topic-return) plus optional auxiliary tags."
    },
    "description": {
      "type": "string",
      "description": "Human-readable summary of what this case verifies and why."
    },
    "setup": {
      "type": "object",
      "required": ["observers", "memorySnapshot"],
      "properties": {
        "observers": {
          "type": "array",
          "minItems": 1,
          "items": { "type": "string" },
          "description": "Observer agent IDs (e.g. ['agent-a', 'agent-b'])."
        },
        "memorySnapshot": {
          "type": "string",
          "description": "Path to a fixture file under shared-agent/evals/fixtures/, or 'none' for empty state."
        },
        "styleOverrides": {
          "type": "object",
          "additionalProperties": { "type": "string" },
          "description": "Per-observer style.md overrides. Key = observer ID, value = fixture path or inline text."
        },
        "profileOverrides": {
          "type": "object",
          "additionalProperties": { "type": "string" },
          "description": "Per-observer profile.core.json overrides."
        },
        "affectionSeed": {
          "type": "object",
          "description": "Pre-seeded affection states. Key = 'observerId::otherId'.",
          "additionalProperties": {
            "type": "object",
            "required": ["label", "dimensions"],
            "properties": {
              "label": {
                "type": "string",
                "enum": [
                  "stranger",
                  "acquaintance",
                  "friendly_acquaintance",
                  "good_terms",
                  "close",
                  "strained",
                  "distant",
                  "friendly_but_cautious"
                ]
              },
              "dimensions": {
                "type": "object",
                "properties": {
                  "familiarity": { "type": "number", "minimum": 0, "maximum": 100 },
                  "warmth": { "type": "number", "minimum": 0, "maximum": 100 },
                  "trust": { "type": "number", "minimum": 0, "maximum": 100 },
                  "tension": { "type": "number", "minimum": 0, "maximum": 100 }
                }
              }
            }
          }
        }
      },
      "additionalProperties": false
    },
    "input": {
      "type": "object",
      "required": ["turns"],
      "properties": {
        "turns": {
          "type": "array",
          "minItems": 1,
          "items": {
            "type": "object",
            "required": ["speaker_id", "content"],
            "properties": {
              "speaker_id": { "type": "string" },
              "content": { "type": "string", "minLength": 1 },
              "turn_index": { "type": "integer", "minimum": 0 },
              "goldenRef": {
                "type": "string",
                "description": "Path to a golden conversation file containing full multi-turn transcript."
              }
            },
            "additionalProperties": false
          }
        },
        "sessionId": { "type": "string" },
        "topicState": {
          "type": "object",
          "description": "Initial topic state to inject before running the case.",
          "properties": {
            "phase": { "type": "string", "enum": ["opening", "ongoing", "closing"] },
            "main_topic": { "type": "string" },
            "active_subtopic": { "type": "string" },
            "focus": { "type": "string", "enum": ["main", "sub"] }
          }
        }
      },
      "additionalProperties": false
    },
    "assertions": {
      "type": "array",
      "minItems": 1,
      "items": {
        "type": "object",
        "required": ["assertType", "target", "expect"],
        "properties": {
          "assertType": {
            "type": "string",
            "enum": ["rule", "llm-judge"],
            "description": "rule = deterministic assertion (no LLM); llm-judge = requires LLM evaluation."
          },
          "target": {
            "type": "string",
            "enum": [
              "composer-output-contains",
              "composer-output-not-contains",
              "composer-token-budget",
              "composer-layer-order",
              "memory-share-policy",
              "memory-observer-isolation",
              "memory-no-pii",
              "hearsay-promote-status",
              "hearsay-confidence-threshold",
              "hearsay-not-in-objective-facts",
              "topic-transition-type",
              "topic-main-persists",
              "topic-subtopic-stack",
              "topic-summary-length",
              "affection-label-eq",
              "affection-dimension-range",
              "affection-overlay-contains",
              "affection-overlay-not-contains"
            ]
          },
          "expect": {
            "description": "Expected value or pattern. Structure depends on target."
          },
          "llmPrompt": {
            "type": "string",
            "description": "LLM judge evaluation prompt. Only required when assertType = 'llm-judge'."
          },
          "llmModel": {
            "type": "string",
            "description": "Model override per assertion (defaults to DEEPSEEK_API_KEY model)."
          },
          "severity": {
            "type": "string",
            "enum": ["blocking", "warning"],
            "default": "blocking",
            "description": "blocking = CI fail on this assertion; warning = log only."
          }
        },
        "additionalProperties": false
      }
    },
    "requiresLlm": {
      "type": "boolean",
      "description": "true if any assertion uses llm-judge or if the mechanism itself requires LLM (e.g. SocialExtract is LLM-powered even for rule-based assertions against its output)."
    },
    "expectedDurationMs": {
      "type": "integer",
      "minimum": 0,
      "description": "Approximate expected runtime in milliseconds. Used for CI tier routing."
    },
    "sourceSmokeTest": {
      "type": "string",
      "description": "If this case was migrated from an existing smoke test, record the source file path."
    }
  },
  "additionalProperties": false
}
